{"amendment":{"amendment_id":"s00-successor-recovery-001","head_sha256":"ec0e72c60aaa2d4ea1b54545aa1c9cbd2039401447bcca6d0d374e1866ee77b2","path":"study_docs/research/ductile-origami-warmstart/protocol/v1/amendment-ledger.jsonl","raw_sha256":"92da8dde11de879c573018a1f968648cef6f328ba44cee06e83f3b379ce81619"},"authorities":[{"path":".cursor/rules/hipblaslt-onboarding.mdc","sha256":"c076e9492cbfd75d3519a28af597187e41e17e4ec790f917a94ef68f0e388bb0"},{"path":".cursor/skills/implement-verify-loop/SKILL.md","sha256":"e7eaf11f30b141d0069e29f5d38afa273be21c07008f25350fc09258ed15d5a0"},{"path":"study_docs/research/surrogate-dse-plan.md","sha256":"943bbb981b8625c50f53a84bd75005b346822083d1e1b22750b3c39898e252f6"},{"path":"study_docs/research/ductile-origami-warmstart-experiment-plan.md","sha256":"48e64a29c559e130c02fe60e61adc630d676df41cf5ec92a2d6156eb68ea5e73"},{"path":"study_docs/research/ductile-origami-warmstart/README.md","sha256":"b63f37b5a9ada937b8c67f337b604c74b6682ec513cb77984634dbb01bbc82e5"},{"path":"study_docs/research/ductile-origami-warmstart/s00-evidence-contract-lineage-observability-design.md","sha256":"c3698947fbb58bb34b4f346848f8aa5a33c8ef3a18a46c3f864ed28b08914fc1"}],"baseline_commit":"60775f12843bee9f95cb0bef4e91de8bc4dc9dc3","body_sha256":"51744fdaf66b580118189ed0027b025eff2f67d733a0f6b06059df6dfe3b0ef3","checkpoint_id":"S00","contract":{"path":"study_docs/research/ductile-origami-warmstart/protocol/v1/study-contract.yaml","sha256":"914cda8051406dc44dda6381f094ab91852c391b78f3f2b86226192925abf549"},"creation":{"command":"PYTHONPATH=projects/hipblaslt/tensilelite python3 -B study_docs/research/ductile-origami-warmstart/protocol/v1/run_s00_foundation.py lock-successor --original-plan-b agent_run/260725-ductile-factorized-guidance-s0-s2/milestones/S00/plan_b.md --recovery-plan-b agent_run/260725-ductile-factorized-guidance-s0-s2/milestones/S00/recovery/plan_b.md","cwd":"/data1/perlee/rocm-libraries"},"delivery_whitelist":["projects/hipblaslt/tensilelite/Tensile/ductile/algorithm/ga.py","projects/hipblaslt/tensilelite/Tensile/ductile/evidence.py","projects/hipblaslt/tensilelite/Tensile/Tests/unit/test_ductile_s00_foundation.py","study_docs/research/ductile-origami-warmstart/protocol/v1/README.md","study_docs/research/ductile-origami-warmstart/protocol/v1/study-contract.yaml","study_docs/research/ductile-origami-warmstart/protocol/v1/amendment-ledger.jsonl","study_docs/research/ductile-origami-warmstart/protocol/v1/run_s00_foundation.py","study_docs/research/ductile-origami-warmstart/protocol/v1/schemas/study-contract.schema.json","study_docs/research/ductile-origami-warmstart/protocol/v1/schemas/amendment.schema.json","study_docs/research/ductile-origami-warmstart/protocol/v1/schemas/lock.schema.json","study_docs/research/ductile-origami-warmstart/protocol/v1/schemas/event.schema.json","study_docs/research/ductile-origami-warmstart/protocol/v1/schemas/checkpoint.schema.json","study_docs/research/ductile-origami-warmstart/protocol/v1/schemas/lineage.schema.json","study_docs/research/ductile-origami-warmstart/protocol/v1/fixtures/valid-run.json","study_docs/research/ductile-origami-warmstart/protocol/v1/fixtures/invalid-lineage.json","study_docs/research/ductile-origami-warmstart/protocol/v1/fixtures/duplicate-events.json","study_docs/research/ductile-origami-warmstart/protocol/v1/fixtures/backend-failure.json","study_docs/research/ductile-origami-warmstart/protocol/v1/locks/s00-foundation-lock.json","study_docs/research/ductile-origami-warmstart/protocol/v1/evidence/s00-neutrality.json","study_docs/research/ductile-origami-warmstart/protocol/v1/evidence/s00-resume-parity.json","study_docs/research/ductile-origami-warmstart/protocol/v1/evidence/s00-reconciliation.json","study_docs/research/ductile-origami-warmstart/protocol/v1/evidence/s00-lineage-fail-closed.json","study_docs/research/ductile-origami-warmstart/protocol/v1/evidence/s00-decision.json","study_docs/research/ductile-origami-warmstart/reports/staged/s00-foundation-verification-report.md","study_docs/research/ductile-origami-warmstart-experiment-plan.md","study_docs/research/ductile-origami-warmstart/README.md","study_docs/research/ductile-origami-warmstart/s00-evidence-contract-lineage-observability-design.md","study_docs/research/ductile-origami-warmstart/protocol/v1/locks/s00-foundation-lock-successor-001.json","study_docs/research/ductile-origami-warmstart/protocol/v1/evidence/s00-neutrality-successor-001.json","study_docs/research/ductile-origami-warmstart/protocol/v1/evidence/s00-resume-parity-successor-001.json","study_docs/research/ductile-origami-warmstart/protocol/v1/evidence/s00-reconciliation-successor-001.json","study_docs/research/ductile-origami-warmstart/protocol/v1/evidence/s00-lineage-fail-closed-successor-001.json","study_docs/research/ductile-origami-warmstart/protocol/v1/evidence/s00-decision-successor-001.json"],"delivery_whitelist_sha256":"0632d43fafc8bf583d0ebdad60f1c832d7be4a0022f08602bcff61ec135deb5e","fixtures":[{"path":"study_docs/research/ductile-origami-warmstart/protocol/v1/fixtures/valid-run.json","sha256":"cd078bef8d81040b25a31d507f09d981eb4542fa424b4579d6485121da272e10"},{"path":"study_docs/research/ductile-origami-warmstart/protocol/v1/fixtures/invalid-lineage.json","sha256":"19a56c64d8fe9747169306fd028a5c4477afe04ceda8fb3137bf7ae44c943e83"},{"path":"study_docs/research/ductile-origami-warmstart/protocol/v1/fixtures/duplicate-events.json","sha256":"be06a69c86c68642f02fed65c7116a3916a7450a1f571d01743975bd3bb60145"},{"path":"study_docs/research/ductile-origami-warmstart/protocol/v1/fixtures/backend-failure.json","sha256":"18604c68251e7de0836ac13a0b6541c087b1cd5d4eb91fe84f73f126f18c87e6"}],"formal_report":{"canonical_identity_sha256":"0a758be4e5454479901972a24d3ab1fdc6b48e84f424568a277affad7e193696","path":"study_docs/research/ductile-origami-warmstart/reports/staged/s00-foundation-verification-report.md"},"generation":"successor-001","immutable_old_generation":[{"path":"study_docs/research/ductile-origami-warmstart/protocol/v1/locks/s00-foundation-lock.json","sha256":"35d0c98cd9f6058fe21cd8723288d5bc34d68b87c3bf9e4bc9a0b7c488a0691c"},{"path":"study_docs/research/ductile-origami-warmstart/protocol/v1/evidence/s00-neutrality.json","sha256":"ada294f5cbf62643490564e52b8cb88092c8b6c07ad09ab7e8030f2bf436a315"},{"path":"study_docs/research/ductile-origami-warmstart/protocol/v1/evidence/s00-resume-parity.json","sha256":"fe447f49989ad4996358cbeae60918c3209eebce314154ec022ad1e95b402281"},{"path":"study_docs/research/ductile-origami-warmstart/protocol/v1/evidence/s00-reconciliation.json","sha256":"bf6b83e739c6fc4c8dd437675f6b8f2cbeeceb31c3c287c71a877318cf04597a"},{"path":"study_docs/research/ductile-origami-warmstart/protocol/v1/evidence/s00-lineage-fail-closed.json","sha256":"05a0fa9be80174a560de180ceb8bfe0399bb7ca01d625b0961910b97d1e46a82"},{"path":"study_docs/research/ductile-origami-warmstart/protocol/v1/evidence/s00-decision.json","sha256":"e73601ba108c31ac15d3372b8b951b8f5b50110071a5d74f8c5f982f5ac101c0"}],"implementation_whitelist":["projects/hipblaslt/tensilelite/Tensile/ductile/algorithm/ga.py","projects/hipblaslt/tensilelite/Tensile/ductile/evidence.py","projects/hipblaslt/tensilelite/Tensile/Tests/unit/test_ductile_s00_foundation.py","study_docs/research/ductile-origami-warmstart/protocol/v1/README.md","study_docs/research/ductile-origami-warmstart/protocol/v1/study-contract.yaml","study_docs/research/ductile-origami-warmstart/protocol/v1/amendment-ledger.jsonl","study_docs/research/ductile-origami-warmstart/protocol/v1/run_s00_foundation.py","study_docs/research/ductile-origami-warmstart/protocol/v1/schemas/study-contract.schema.json","study_docs/research/ductile-origami-warmstart/protocol/v1/schemas/amendment.schema.json","study_docs/research/ductile-origami-warmstart/protocol/v1/schemas/lock.schema.json","study_docs/research/ductile-origami-warmstart/protocol/v1/schemas/event.schema.json","study_docs/research/ductile-origami-warmstart/protocol/v1/schemas/checkpoint.schema.json","study_docs/research/ductile-origami-warmstart/protocol/v1/schemas/lineage.schema.json","study_docs/research/ductile-origami-warmstart/protocol/v1/fixtures/valid-run.json","study_docs/research/ductile-origami-warmstart/protocol/v1/fixtures/invalid-lineage.json","study_docs/research/ductile-origami-warmstart/protocol/v1/fixtures/duplicate-events.json","study_docs/research/ductile-origami-warmstart/protocol/v1/fixtures/backend-failure.json","study_docs/research/ductile-origami-warmstart/protocol/v1/locks/s00-foundation-lock.json","study_docs/research/ductile-origami-warmstart/protocol/v1/evidence/s00-neutrality.json","study_docs/research/ductile-origami-warmstart/protocol/v1/evidence/s00-resume-parity.json","study_docs/research/ductile-origami-warmstart/protocol/v1/evidence/s00-reconciliation.json","study_docs/research/ductile-origami-warmstart/protocol/v1/evidence/s00-lineage-fail-closed.json","study_docs/research/ductile-origami-warmstart/protocol/v1/evidence/s00-decision.json","study_docs/research/ductile-origami-warmstart/protocol/v1/locks/s00-foundation-lock-successor-001.json","study_docs/research/ductile-origami-warmstart/protocol/v1/evidence/s00-neutrality-successor-001.json","study_docs/research/ductile-origami-warmstart/protocol/v1/evidence/s00-resume-parity-successor-001.json","study_docs/research/ductile-origami-warmstart/protocol/v1/evidence/s00-reconciliation-successor-001.json","study_docs/research/ductile-origami-warmstart/protocol/v1/evidence/s00-lineage-fail-closed-successor-001.json","study_docs/research/ductile-origami-warmstart/protocol/v1/evidence/s00-decision-successor-001.json"],"implementation_whitelist_sha256":"9686eab5037145252bc2233e514e5a050b2662352c78d4dcd3ce7ecb716f6aa6","lock_id":"s00-lock-51744fdaf66b580118189ed0027b025eff2f67d733a0f6b06059df6dfe3b0ef3","parent_lock":{"lock_id":"s00-lock-6c9bc5c909f46d287cada9e8b8a3b74d51e6a36dabc50ab98218d7d4ac0c1946","sha256":"35d0c98cd9f6058fe21cd8723288d5bc34d68b87c